{
  "schema": "frank.context-pack/v1",
  "packId": "pack-2026-08-01-central-memory",
  "assignmentId": "run-2026-08-01-0007",
  "cellId": "cell-steven-primary",
  "createdAt": "2026-08-01T01:25:00.000Z",
  "goal": "Recall relevant owner memories and inject them, as a distinct generated-untrusted section, into the Central room turn before it reaches the harness; store newly confirmed facts after the turn.",
  "definitionOfDone": [
    "Recalled facts appear in the harness prompt under a labelled generated-untrusted section",
    "No secret or credential value is present in the assembled pack",
    "The pack content hash is stable across two assemblies from identical inputs"
  ],
  "requirements": ["FRANK-§7.4", "BRAIN-006", "ADR-014"],
  "adrExcerpts": [
    "ADR-014: Steven reviews an evidence pack, not an unbuilt proposal."
  ],
  "sources": [
    {
      "path": "apps/web/src/app/api/chat/route.ts",
      "sha256": "sha256:3a7f1c9e0b2d4f6a8c1e3b5d7f9a2c4e6b8d0f1a3c5e7b9d1f3a5c7e9b0d2f4a"
    },
    {
      "path": "adapters/harness/goose/src/types.ts",
      "symbol": "HarnessAdapter",
      "sha256": "sha256:9c1e3b5d7f9a2c4e6b8d0f1a3c5e7b9d1f3a5c7e9b0d2f4a6c8e0b1d3f5a7c9e"
    }
  ],
  "relatedWork": [
    "Workstream 4 domain kernel (work-view.ts) supplies the assignment/WorkItem this pack serves"
  ],
  "constraints": [
    "Harness is replaceable; memory must outlive any harness swap (FRANK-§7.1)",
    "Recalled facts may never be promoted to policy-trusted (FRANK-§2.3)"
  ],
  "allowedTools": [
    { "handle": "tool://memory.recall", "capability": "Query the memory backend for facts relevant to a scope" },
    { "handle": "tool://memory.store", "capability": "Persist newly confirmed facts to the memory backend" }
  ],
  "credentials": [
    { "handle": "secret://mem0.server-api-key", "classification": "secret" }
  ],
  "classification": "private",
  "egress": "frank-internal-only",
  "budget": {
    "maxSpend": 0.5,
    "currency": "USD",
    "deadline": "2026-08-01T02:00:00.000Z",
    "maxRetries": 2
  },
  "expectedOutputs": [
    "A passing unit test proving recall facts are injected under a generated-untrusted label",
    "An evidence manifest referencing this pack's content hash"
  ],
  "evidenceSchemaRef": "schema://frank.evidence/v1",
  "escalation": {
    "escalateWhen": [
      "Recall returns facts classified above the pack's class",
      "The memory backend is unreachable"
    ],
    "doNotAssume": [
      "That a recalled fact is current without a confirmedAt within policy",
      "That the harness will honor the generated-untrusted label on its own"
    ]
  },
  "memory": {
    "recalled": [
      {
        "fact": "Steven uses an Android Pixel 10, not iOS.",
        "trust": "generated-untrusted",
        "sourceId": "src-utterance-2026-07-30-device",
        "classification": "internal",
        "relevance": 0.82,
        "confirmedAt": "2026-07-30T18:04:11.000Z"
      },
      {
        "fact": "Frank must never be a skin over a single agent provider.",
        "trust": "generated-untrusted",
        "sourceId": "src-spec-frank-§7",
        "classification": "internal",
        "relevance": 0.71
      }
    ],
    "recallQuery": "owner device preferences and Frank memory ownership constraints",
    "backend": "mem0@vps:8888"
  },
  "integrity": {
    "contentHash": "sha256:b2d4f6a8c1e3b5d7f9a2c4e6b8d0f1a3c5e7b9d1f3a5c7e9b0d2f4a6c8e0b1d3",
    "signerId": "frank://kernel/assembler",
    "signature": "ed25519:MEUCIQDk3f6a8c1e3b5d7f9a2c4e6b8d0f1a3c5e7b9d1f3a5c7e9b0d2f4a6c8e0b1AiEA",
    "signedAt": "2026-08-01T01:25:00.400Z"
  }
}
